{
  "artefacts": {
    "diagnostics": {
      "bytes": null,
      "reason": "boundary_not_reached",
      "relative_path": "diagnostics.json",
      "sha256": null,
      "written": false
    },
    "input": {
      "bytes": null,
      "reason": "boundary_not_reached",
      "relative_path": "config.input.yaml",
      "sha256": null,
      "written": false
    },
    "journal": {
      "bytes": null,
      "reason": "transaction_not_reached",
      "relative_path": ".rheplicant-journal",
      "sha256": null,
      "written": false
    },
    "lock": {
      "bytes": null,
      "reason": "transaction_not_reached",
      "relative_path": ".rheplicant-lock",
      "sha256": null,
      "written": false
    },
    "marker": {
      "bytes": null,
      "reason": "boundary_not_reached",
      "relative_path": ".rheplicant-results.json",
      "sha256": null,
      "written": false
    },
    "provenance": {
      "bytes": null,
      "reason": "boundary_not_reached",
      "relative_path": "provenance.json",
      "sha256": null,
      "written": false
    },
    "resolved_base": {
      "bytes": null,
      "reason": "layer_not_complete",
      "relative_path": "config.resolved.yaml",
      "sha256": null,
      "written": false
    },
    "resolved_variants": []
  },
  "completed_boundaries": [
    {
      "layer": null,
      "stage": "source"
    },
    {
      "layer": null,
      "stage": "serialization"
    }
  ],
  "deferred_validations": [],
  "error": null,
  "findings": [],
  "format_version": 1,
  "gates": [],
  "runs": [],
  "status": "ok"
}
